{
  "aliases": [
    "Alpha-methyltryptamine",
    "alpha-methyltryptamine",
    "alphamethyltryptamine",
    "indopan",
    "monase"
  ],
  "categories": [
    "psychedelic",
    "stimulant",
    "research-chemical"
  ],
  "formatted_aftereffects": {
    "_unit": "hours",
    "value": "6-12"
  },
  "formatted_dose": {
    "Oral": {
      "Common": "25-40mg",
      "Heavy": "60mg+",
      "Light": "15-25mg",
      "Strong": "40-60mg"
    }
  },
  "formatted_duration": {
    "_unit": "hours",
    "value": "10-16"
  },
  "formatted_effects": [
    "Euphoria",
    "empathy",
    "insight",
    "brightened colour",
    "Closed/Open eye visuals",
    "enhanced tactile sensation",
    "mental/physical stimulation",
    "decreased appetite",
    "pupil dilation",
    "restlessness",
    "change in perception",
    "ego softening",
    "sweating/chills",
    "muscle tension",
    "confusion",
    "insomnia"
  ],
  "formatted_onset": {
    "_unit": "minutes",
    "value": "30-90"
  },
  "links": {
    "experiences": "https://www.erowid.org/experiences/subs/exp_AMT.shtml"
  },
  "name": "amt",
  "pretty_name": "αMT",
  "properties": {
    "after-effects": "6-12 hours",
    "aliases": [
      "Alpha-methyltryptamine",
      "alpha-methyltryptamine",
      "alphamethyltryptamine",
      "indopan",
      "monase"
    ],
    "avoid": "Other MAOIs http://www.erowid.org/chemicals/maois/maois_info3.shtml",
    "categories": [
      "psychedelic",
      "stimulant",
      "research-chemical"
    ],
    "detection": "Not tested for in standard drug tests.",
    "dose": "Oral Light: 15-25mg Common: 25-40mg Strong: 40-60mg Heavy: 60mg+",
    "duration": "10-16 hours",
    "effects": "Euphoria, empathy, insight, brightened colour, Closed/Open eye visuals, enhanced tactile sensation, mental/physical stimulation, decreased appetite, pupil dilation, restlessness, change in perception, ego softening, sweating/chills, muscle tension, confusion, insomnia.",
    "onset": "30-90 minutes",
    "summary": "A long-acting psychedelic-empathogen with a broad method of action in the brain. Not suitable for combination with many other substances. Used as an anti-depressant in the Soviet Union, but later found popularity in the RC scene, mainly in the UK."
  }
}
