{
  "aliases": [
    "ludes",
    "quaaludes",
    "qualudes",
    "mandrax"
  ],
  "categories": [
    "depressant",
    "habit-forming"
  ],
  "dose_note": " NOTE: It is strongly recommended to not take greater than 300mg without a methaqualone tolerance.",
  "formatted_aftereffects": {
    "_unit": "hours",
    "value": "4-6"
  },
  "formatted_dose": {
    "Oral": {
      "Common": "150-300mg",
      "Light": "75-150mg",
      "Strong": "300mg+"
    }
  },
  "formatted_duration": {
    "_unit": "hours",
    "value": "5-8"
  },
  "formatted_effects": [
    "Anxiolytic",
    "Sedative",
    "Muscle Relaxant",
    "Amnesia",
    "Dystaxia",
    "Hypnotic"
  ],
  "formatted_onset": {
    "_unit": "minutes",
    "value": "30-45"
  },
  "links": {
    "experiences": "https://www.erowid.org/experiences/subs/exp_Methaqualone.shtml"
  },
  "name": "methaqualone",
  "pretty_name": "Methaqualone",
  "properties": {
    "after-effects": "4-6 hours.",
    "aliases": [
      "ludes",
      "quaaludes",
      "qualudes",
      "mandrax"
    ],
    "avoid": "All other CNS depressants.",
    "categories": [
      "depressant",
      "habit-forming"
    ],
    "dose": "Oral Light: 75-150mg Common: 150-300mg Strong: 300mg+ | NOTE: It is strongly recommended to not take greater than 300mg without a methaqualone tolerance.",
    "duration": "5-8 hours.",
    "effects": "Anxiolytic, Sedative, Muscle Relaxant, Amnesia, Dystaxia, Hypnotic.",
    "onset": "30-45 minutes",
    "summary": "A pharmaceutical depressant and sedative phased out due to alternative drugs becoming readily available with greater safety profiles. Part of the Qualone group of substances. The drug is considered extremely rare in all parts of the world except in South Africa, where use and abuse remain high."
  },
  "pweffects": {
    "Acuity suppression": "https://psychonautwiki.org/wiki/Acuity_suppression",
    "Anxiety suppression": "https://psychonautwiki.org/wiki/Anxiety_suppression",
    "Changes in gravity": "https://psychonautwiki.org/wiki/Changes_in_gravity",
    "Cognitive euphoria": "https://psychonautwiki.org/wiki/Cognitive_euphoria",
    "Compulsive redosing": "https://psychonautwiki.org/wiki/Compulsive_redosing",
    "Constipation": "https://psychonautwiki.org/wiki/Constipation",
    "Disinhibition": "https://psychonautwiki.org/wiki/Disinhibition",
    "Dizziness": "https://psychonautwiki.org/wiki/Dizziness",
    "Double vision": "https://psychonautwiki.org/wiki/Double_vision",
    "Dream potentiation": "https://psychonautwiki.org/wiki/Dream_potentiation",
    "Increased libido": "https://psychonautwiki.org/wiki/Increased_libido",
    "Information processing suppression": "https://psychonautwiki.org/wiki/Information_processing_suppression",
    "Internal hallucinations": "https://psychonautwiki.org/wiki/Internal_hallucinations",
    "Motor control loss": "https://psychonautwiki.org/wiki/Motor_control_loss",
    "Muscle relaxation": "https://psychonautwiki.org/wiki/Muscle_relaxation",
    "Physical euphoria": "https://psychonautwiki.org/wiki/Physical_euphoria",
    "Respiratory depression": "https://psychonautwiki.org/wiki/Respiratory_depression",
    "Sedation": "https://psychonautwiki.org/wiki/Sedation",
    "Subconscious communication": "https://psychonautwiki.org/wiki/Subconscious_communication",
    "Thought deceleration": "https://psychonautwiki.org/wiki/Thought_deceleration",
    "Visual disconnection": "https://psychonautwiki.org/wiki/Visual_disconnection"
  }
}
